order,word,phonetic,example,note,definition_en
1,desk,/dɛsk/,I have a picture frame with a family photo on my desk.,,
2,chair,/tʃɛr/,I placed my bag on the empty chair next to me.,,
3,table,/ˈteɪbəl/,I cleared the table after dinner and washed the dishes.,,
4,sofa,/ˈsoʊfə/,"I spilled some coffee on the sofa, so I quickly cleaned it up.",,
5,bed,/bɛd/,I have a bedside table next to my bed for my books and glasses.,,
6,cabinet,/ˈkæbənɪt/,"The cabinet doors are made of glass, allowing us to see inside.",,
7,refrigerator,/rɪˈfrɪdʒəˌreɪtɚ/,I opened the fridge to get a bottle of water.,,
8,television,/ˈtɛləˌvɪʒən/,She watched her favorite show on the TV last night.,,
9,stove,/stoʊv/,I accidentally burned my hand on the hot stove.,,
