ÔĽŅorder,word,phonetic,example,note,definition_en
1,thundering,/ňąőł…ônd…Ě…™Ňč/,"As the explorers approached the entrance, the thundering cave impressed them with its colossal dimensions.",,
2,gargantuan,/…°…Ď…Ļňą…°√¶nt Éu…ôn/,The construction project aimed to build a gargantuan skyscraper that would dominate the city skyline.,,
3,jumbo,/ňąd í…ômbo ä/,"The family ordered a jumbo pizza to satisfy their hunger, featuring an oversized crust and generous toppings.",,
4,whopping,/ňąw…Ďp…™Ňč/,The whopping prize money drew competitors from all over the world to the prestigious tournament.,,
5,humongous,/hjuňąm…ĒŇč…°…ôs/,The explorer marveled at the humongous icebergs that floated majestically in the Arctic Ocean.,,
6,brobdingnagian,/ňĆb…Ļ…Ēbd…™…°ňąn√¶…°i…ôn/,"The chef presented a brobdingnagian cake at the center of the banquet hall, impressing everyone with its grandeur.",,
7,ginormous,/d íňą…™noňź…Ļm…ôs/,"The ginormous pumpkin at the county fair broke records for its size, drawing crowds of amazed spectators.",,
8,colossal,/k…ôňą…ę…Ďs…ô…ę/,The ancient ruins revealed the remains of a colossal structure that once stood as a testament to architectural marvels.,,
9,thumping,/ňąőł…ômp…™Ňč/,"The company celebrated a thumping success with the launch of its groundbreaking product, gaining widespread acclaim.",,
10,walloping,/ňąw…Ē…ę…ôp…™Ňč/,"The company reported a walloping increase in profits, exceeding all expectations for the quarter.",,
11,infinitesimal,/ňĆ…™nf…™n…™ňąt…õs…™m…ô…ę/,The infinitesimal crack in the glass was barely visible to the naked eye.,,
12,titchy,/tňą…™t Éi/,The titchy kitten struggled to climb up the tall couch.,,
13,shrimpy,/ É…Ļňą…™mpi/,The backpacker carried a shrimpy tent that was perfect for solo camping trips.,,
14,vest-pocket,/vňą…õstpňą…Ďňźk…™t/,He always carried a vest-pocket notebook to jot down his creative ideas whenever inspiration struck.,,
15,wee,/ňąwi/,"The toddler toddled around the garden, picking up wee flowers with tiny hands.",,
16,ickle,/ňąa…™k…ôl/,"The ickle puppy snuggled into its bed, looking adorable and tiny.",,
17,stupendous,/stuňąp…õnd…ôs/,"The company faced stupendous debts, making it difficult to recover financially.",,
18,prodigious,/p…Ļ…ôňąd…™d í…ôs/,The earthquake caused a prodigious amount of damage to the city.,,
19,stately,/ňąste…™t…ęi/,"The stately mountain range stretched across the horizon, displaying a rugged and impressive natural landscape.",,
20,altitudinous,/ňĆ√¶lt…™tňąuňźd…™n…ôs/,"The altitudinous mountain peaks were covered in snow, creating a breathtaking and majestic vista.",,
21,sweeping,/ňąswip…™Ňč/,The sweeping coastline was visible from the hilltop.,,
22,commodious,/k…ôňąmo ädi…ôs/,"Despite the car's compact exterior, the interior is commodious, offering ample legroom and cargo space.",,
23,voluminous,/v…ôňą…ęum…ôn…ôs/,She wore a voluminous gown that swept across the ballroom floor.,,
