order,word,phonetic,example,note,definition_en
1,to recede,/ɹɪˈsid/,"As the sun dipped below the horizon, the colors of the sunset receded.",,
2,to redouble,/ɹiˈdəbəɫ/,"After the criticism, she redoubled her efforts to improve her performance.",,
3,to compound,"/ˈkɑmpaʊnd/, /kəmˈpaʊnd/",Ignoring the initial warning signs only served to compound the difficulties the team faced in completing the project on time.,,
4,to aggrandize,/əˈɡɹænˌdaɪz/,They had aggrandized their company's success in the report.,,
5,to assuage,/əˈsweɪdʒ/,She tried to assuage his fears by reassuring him that everything would be alright.,,
6,to exalt,/ɪɡˈzɔɫt/,"The breathtaking sunset served to exalt the beauty of the landscape, casting vibrant hues across the sky.",,
7,to attenuate,/əˈtɛnjuˌeɪt/,The effectiveness of the treatment has attenuated over time.,,
8,to stifle,/ˈstaɪfəɫ/,The strict rules and regulations served to stifle creativity and innovation within the organization.,,
9,to palliate,/pˈælɪˌeɪt/,The public relations team worked to palliate the negative impact of the scandal by releasing a carefully crafted statement.,,
10,to wane,/ˈweɪn/,The popularity of the trend is currently waning among the younger generation.,,
11,to step up,/stˈɛp ˈʌp/,The government decided to step up security measures in response to the increased threat.,,
12,to tamp down,/tˈæmp dˈaʊn/,The firefighter worked to tamp down the flames with a fire extinguisher.,,
13,drastic,/ˈdɹæstɪk/,She made the drastic decision to quit her job and travel the world.,,
14,searing,/ˈsɪɹɪŋ/,The searing heat of the desert made it difficult to travel during the day.,,
15,unmitigated,/ənˈmɪtəˌɡeɪtɪd/,"The unmitigated chaos ensued as the protesters clashed with law enforcement, resulting in widespread violence.",,
16,mitigation,/ˌmɪtɪˈɡeɪʃən/,The construction project included mitigation measures to minimize the impact on the local ecosystem and wildlife.,,
