容쯢rder,word,phonetic,example,note,definition_en
1,knotty,/틛n톔ti/,"The negotiations between the two countries were knotty, with conflicting interests and historical tensions.",,
2,byzantine,"/틛b톩z톛n틟ta톩n/, /틛b톩z톛n틟tin/",The Byzantine bureaucracy of the government made it challenging for citizens to navigate and obtain permits.,,
3,confounding,/k톛n틛fa툵nd톩콂/,"The results of the scientific experiment were confounding, as they contradicted established theories.",,
4,inscrutable,/틟톩ns틛k톷ut톛b톛톪/,"The Mona Lisa's smile is one of the most analyzed, yet still remains mysteriously inscrutable.",,
5,muddled,/틛m톛d톛톪d/,The muddled instructions on the packaging left consumers uncertain about the proper assembly of the furniture.,,
6,unfathomable,/톛n틛f칝칧톛m톛b톛톪/,"The universe's unfathomable vastness continues to perplex astronomers, challenging our understanding of its boundaries.",,
7,abstruse,/톛b틛st톷us/,"The professor's abstruse lecture on theoretical physics left many students bewildered, struggling to grasp the complex concepts.",,
8,enigmatic,/틟톝n톩토틛m칝t톩k/,The author's choice of ending for the novel was enigmatic and sparked much debate.,,
9,impenetrable,/틟톩m틛p톝n톛t톷톛b톛톪/,The professor's lectures on quantum mechanics were so impenetrable that most students struggled to grasp the concepts.,,
10,labyrinthine,/틟톪칝b톟틛톩n틟풪in/,The plot of the mystery novel was so labyrinthine that readers struggled to follow all the twists and turns.,,
11,recondite,/틛톷톝k톛n틟da톩t/,The ancient text contained recondite wisdom that took years to decipher.,,
12,idiot-proof,/틛톩d톩톛tp톷틛u틣f/,"The new software was designed to be idiot-proof, with simple, intuitive interfaces and clear instructions.",,
13,grueling,"/틛토톷u톩톪톩콂/, /틛토톷u톪톩콂/",The marathon runners faced a grueling challenge as they pushed themselves to complete the race.,,
14,daunting,/틛d톖nt톩콂/,"The idea of moving to a new country, learning a new language, and starting from scratch can be daunting for many.",,
15,Sisyphean,/s틛톩s톩f틟i톛n/,"The constant battle against bureaucracy felt like a Sisyphean task for the government employee, who struggled to enact meaningful change.",,
16,Herculean,/h톟k틛ju톪i톛n/,The construction of the massive skyscraper was a Herculean task that required years of planning and execution.,,
17,draining,/틛d톷e톩n톩콂/,"The relentless workload at the office was draining, leaving employees fatigued and in need of a break.",,
18,thorny,/틛풪톖톷ni/,The negotiations between the two countries hit a thorny issue regarding trade tariffs.,,
19,painstaking,/틛pe톩n틟ste톩k톩콂/,She conducted a painstaking investigation to uncover the truth behind the mysterious disappearance.,,
20,onerous,/틛o툵n톟톛s/,"The new regulations placed on businesses by the government were onerous, requiring extensive paperwork and compliance measures.",,
21,convoluted,/틛k톔nv톛틟톪ut톛d/,The lawyer's convoluted argument confused the jury rather than clarifying the case.,,
22,exacting,/톩토틛z칝kt톩콂/,"Her boss had an exacting schedule, leaving little free time.",,
23,uphill,/틛톛p틛h톩톪/,"The project faced an uphill battle from the start, with tight deadlines and limited resources.",,
24,to surmount,/s톟틛ma툵nt/,She worked hard to surmount the obstacles in her academic journey and graduated with honors.,,
25,esoteric,"/틟톝s톛틛t톝톷톩k/, /틟톝so툵틛t톝톷톩k/",The professor's esoteric lecture on philosophy was difficult for most students to follow.,,
26,to brave,/bre톩v/,She braved the storm to ensure everyone was safe in the shelter.,,
27,cinch,/틛s톩nt툮/,Fixing the minor glitch in the software turned out to be a cinch for the experienced programmer.,,
