ÔĽŅorder,word,phonetic,example,note,definition_en
1,meteorology,/ňĆmiňźti…ôňąr…Ďl…ôd íi/,She decided to pursue a career in meteorology after developing a fascination with weather patterns and storm systems.,,
2,to clear up,/kl…™r  Ćp/,"The rain clouds began to dissipate, and the sky started to clear up, promising a sunny afternoon.",,
3,to drift,/dr…™ft/,"As the autumn leaves fell from the trees, they would drift with the gentle breeze.",,
4,changeability,/ňĆ ße…™nd í…ôňąb…™l…™ti/,The changeability of the weather in this region makes it difficult to plan outdoor events in advance.,,
5,visibility,/ňĆv…™z…ôňąb…™l…™ti/,"The dense fog reduced visibility on the highway, causing several cars to slow down to avoid accidents.",,
6,to soak,/so äk/,"The sudden downpour soaked everyone at the outdoor concert, leaving them drenched and scrambling for cover.",,
7,downpour,/ňąda änp…Ēr/,"The unexpected downpour caught everyone off guard, forcing them to seek shelter under shop awnings.",,
8,front,/fr Ćnt/,The weather forecast predicted thunderstorms as a cold front was expected to move through the region.,,
9,gale,/…°e…™l/,"The fishing boats stayed in port as a strong gale blew across the coast, making the sea too dangerous.",,
10,puddle,/ňąp Ćd…ôl/,"After the rain, a large puddle formed at the end of the driveway, making it difficult to navigate.",,
11,snowdrift,/ňąsno äňĆdr…™ft/,"After the blizzard, we found ourselves trapped in our house due to the massive snowdrift blocking the front door.",,
12,torrent,/ňąt…Ēr…ônt/,"The river turned into a raging torrent after heavy rainfall, sweeping away everything in its path.",,
13,vapor,/ňąve…™p…ö/,"The morning mist rose from the lake, forming a delicate vapor that shrouded the landscape.",,
14,thundercloud,/ňąőł Ćnd…öňĆkla äd/,"The sky darkened as thunderclouds gathered on the horizon, signaling an approaching storm.",,
15,whirlwind,/ňąw…ĚňźlňĆw…™nd/,"The children ran through the park, laughing and playing, caught up in a whirlwind of excitement.",,
16,cloudburst,/ňąkla ädňĆb…Ěňźst/,"The sudden cloudburst caught us by surprise, drenching us within minutes.",,
17,baking,/ňąbe…™k…™Ňč/,"The desert sun beat down, creating a baking heat that seemed to sear everything in its path.",,
18,breezy,/ňąbriňźzi/,"The day was breezy, with a gentle wind rustling through the trees.",,
19,climatic,/kla…™ňąm√¶t…™k/,"The climatic conditions in the region vary greatly throughout the year, from hot and dry summers to cold and snowy winters.",,
20,dense,/d…õns/,The fog was so dense that I could barely see beyond a few feet in front of me.,,
21,dull,/d Ćl/,"The sky was dull and overcast, casting a gray pall over the landscape.",,
22,extreme,/…õkňąst…Ļim/,"The hikers faced extreme weather conditions during their ascent, including freezing temperatures and high winds.",,
23,favorable,/ňąfe…™v…ö…ôb…ôl/,"The sailors rejoiced when they felt the favorable wind fill their sails, speeding their journey across the ocean.",,
24,gloomy,/ňą…°lumi/,"The sky grew increasingly gloomy as dark clouds gathered overhead, threatening to unleash a downpour.",,
25,glorious,/ňą…°l…Ēri…ôs/,The beach was packed with sunbathers enjoying the glorious weather and clear blue skies.,,
26,misty,/ňąm…™sti/,"The morning was misty, with a soft haze enveloping the landscape.",,
27,temperate,/ňąt…õmp…ö…ôt/,"The Mediterranean region is known for its temperate climate, characterized by mild winters and warm summers.",,
28,unpredictable,/ňĆ Ćnpr…™ňąd…™kt…ôb…ôl/,"The weather in this region is highly unpredictable, with sudden changes in temperature and frequent storms.",,
29,atmospheric pressure,/ňĆ√¶tm…ôňąsf…õr…™k ňąpr…õ É…ö/,High atmospheric pressure often brings clear skies and stable weather conditions.,,
30,scorching,/ňąsk…Ēr ß…™Ňč/,"The scorching sun beat down on the desert sands, creating a shimmering heat haze.",,
31,hazy,/ňąhe…™zi/,The view of the mountains was hazy due to the heat rising from the valley.,,
32,thunderclap,/ňąőł Ćnd…öňĆkl√¶p/,"The sudden thunderclap startled the children, causing them to run indoors for cover.",,
33,to thaw,/őł…Ē/,"After weeks of cold weather, the ground began to thaw, revealing patches of green grass beneath the snow.",,
34,scorching hot,/ňąsk…Ēr ß…™Ňč h…Ďt/,"The desert experienced scorching hot temperatures, reaching well over 100 degrees Fahrenheit.",,
35,freezing cold,/ňąfriňźz…™Ňč ko äld/,The wind made the already freezing cold temperatures feel even colder.,,
36,famine,/ňąf√¶m…™n/,Many children were orphaned as a result of the famine.,,
