ÔĽŅorder,word,phonetic,example,note,definition_en
1,to lobby,/ňąl…Ďbi/,The environmental group decided to lobby lawmakers for stricter regulations on carbon emissions.,,
2,to reform,/r…™ňąf…Ērm/,The government aims to reform the education system to ensure equal access to quality education for all students.,,
3,diplomatic,/ňĆd…™pl…ôňąm√¶t…™k/,Diplomatic efforts are underway to resolve the conflict peacefully.,,
4,sovereign,/ňąs…Ďvr…ôn/,"The newly established nation declared itself a sovereign state, free from colonial rule.",,
5,radical,/ňąr√¶d…™k…ôl/,The radical activist advocated for the overthrow of the government to establish a new social order.,,
6,activism,/ňą√¶kt…™v…™z…ôm/,Her activism for environmental conservation has inspired many young people to join the cause.,,
7,activist,/ňą√¶kt…™v…™st/,The activist organized a large protest to demand better working conditions for factory employees.,,
8,ambassador,/√¶mňąb√¶s…ôd…ôr/,The ambassador hosted a reception at the embassy to strengthen diplomatic relations between the two nations.,,
9,dictator,/ňąd…™kte…™t…ôr/,The dictator imposed strict censorship laws to suppress any opposition to his regime.,,
10,policy maker,/ňąp…Ďl…ôsi ňąme…™k…ôr/,"As a policy maker, she played a crucial role in shaping the new education reforms.",,
11,propaganda,/ňĆpr…Ďp…ôňą…°√¶nd…ô/,The regime used propaganda to control the narrative and maintain public support.,,
12,autonomy,/…Ēňąt…Ďn…ômi/,The region fought for years to achieve autonomy from the central government.,,
13,constitution,/ňĆk…Ďnst…™ňątu É…ôn/,The constitution of this country guarantees freedom of speech and the separation of powers among its branches of government.,,
14,legislation,/ňĆl…õd í…™sňąle…™ É…ôn/,The parliament passed new legislation aimed at improving environmental protection measures across the country.,,
15,mandate,/ňąm√¶nde…™t/,"After winning the election with a significant majority, the new government claimed a strong mandate to implement their policies.",,
16,bureaucracy,/bj äňąr…Ďkr…ôsi/,"Within a bureaucracy, officials are employed based on expertise rather than being chosen through popular votes.",,
17,cabinet,/ňąk√¶b…ôn…™t/,"The Prime Minister announced changes to the cabinet, appointing new ministers to key portfolios.",,
18,commerce,/ňąk…Ďm…úrs/,"International commerce plays a vital role in global economic development, facilitating trade between nations.",,
19,free trade,/ňąfri ňątre…™d/,Many economists argue that free trade agreements promote economic growth by reducing barriers to international commerce.,,
20,poll,/po äl/,The latest opinion poll indicates a significant shift in public opinion regarding climate change policies.,,
21,alliance,/…ôňąla…™…ôns/,The military alliance between the two countries was formed to enhance mutual defense capabilities.,,
22,ally,/ňą√¶la…™/,"During the war, each nation relied heavily on its allies for resources and support.",,
23,coalition,/ňĆko ä…ôňąl…™ É…ôn/,The coalition government was formed by two major political parties to ensure stability and consensus on key policy issues.,,
24,coup,/ku/,The military launched a coup to overthrow the democratically elected government and seize control of the country.,,
25,exile,/ňą…õ…°za…™l/,"The political dissident lived in exile for over a decade, seeking asylum in neighboring countries.",,
26,wing,/w…™Ňč/,The conservative wing of the party pushed for tax cuts and deregulation.,,
27,treaty,/ňątriti/,The two countries signed a peace treaty to end decades of conflict and establish diplomatic relations.,,
28,capitalism,/ňąk√¶p…™t…ôl…™z…ôm/,Capitalism is an economic system where private individuals and businesses own the means of production and operate for profit.,,
29,communism,/ňąk…Ďmj…ôn…™z…ôm/,Communism is a political and economic ideology advocating for a classless society where the means of production are owned collectively.,,
30,extremism,/…™kňąstrim…™z…ôm/,The rise of political extremism in the region has led to increased tensions and conflicts among communities.,,
31,fascism,/ňąf√¶ É…™z…ôm/,"Fascism rose to prominence in Europe during the early 20th century, leading to the establishment of totalitarian regimes.",,
32,federalism,/ňąf…õd…ôr…ôl…™z…ôm/,"Federalism allows for a division of powers between the national government and state governments, promoting a balance of authority.",,
33,globalism,/ňą…°lo äb…ôl…™z…ôm/,"Globalism has led to increased economic interdependence among nations, fostering international trade and investment.",,
34,liberalism,/ňąl…™b…ôr…ôl…™z…ôm/,"Liberalism emphasizes the importance of individual rights and freedoms, advocating for a society where people can express their views openly.",,
35,socialism,/ňąso ä É…ôl…™z…ôm/,Socialism ensures that public assets benefit the population.,,
36,administrative,/…ôdňąm…™n…™stre…™t…™v/,The administrative staff handles day-to-day operations in the office.,,
37,congressional,/k…ônňą…°r…õ É…ôn…ôl/,Congressional hearings investigate issues and propose legislation.,,
38,constitutional,/ňĆk…Ďnst…™ňątu É…ôn…ôl/,The law passed by the parliament was deemed constitutional by the judiciary.,,
39,electoral,/…™ňąl…õkt…ôr…ôl/,The electoral system determines how representatives are chosen to serve in government.,,
40,interim,/ňą…™nt…ôr…™m/,An interim report was submitted to provide preliminary findings before the full research study was complete.,,
41,protocol,/ňąpro ät…ôňĆk…Ēl/,"The state dinner followed strict diplomatic protocol, including seating arrangements and toasts.",,
42,to table,/ňąte…™b…ôl/,She tabled a motion to discuss increasing funding for public libraries.,,
43,entourage,/ňą…Ďnt är…Ď í/,"The celebrity arrived at the event with a large entourage of bodyguards, assistants, and publicists.",,
44,appeasement,/…ôňąpizm…ônt/,"The policy of appeasement failed to prevent the outbreak of World War II, as aggressive actions continued unchecked.",,
