ÔĽŅorder,word,phonetic,example,note,definition_en
1,detectable,/d…™ňąt…õkt…ôb…ôl/,The slight fragrance of roses was barely detectable in the air.,,
2,empirical,/…õmňąp…™r…™k…ôl/,The scientist relied on empirical data to support her hypothesis about climate change.,,
3,experimental,/…™kňĆsp…õr…ôňąm…õnt…ôl/,The experimental study investigated the effects of meditation on stress levels.,,
4,preliminary,/pr…™ňąl…™m…ôňĆn…õri/,The preliminary investigation revealed important evidence for further examination.,,
5,qualitative,/ňąkw…Ďl…ôňĆte…™t…™v/,The qualitative analysis of the artwork focused on its emotional impact rather than its monetary value.,,
6,quantitative,/ňąkw…Ďnt…ôňĆte…™t…™v/,The study used quantitative data to analyze the correlation between income and happiness.,,
7,scholarly,/ňąsk…Ďl…ôrli/,The scholarly article thoroughly examines the historical context of the Renaissance period.,,
8,theoretical,/ňĆőłi…ôňąr…õt…™k…ôl/,Urban planners relied heavily on theoretical models of traffic flow without real-world validation.,,
9,to correlate,/ňąk…Ēr…ôňĆle…™t/,The increase in exercise tends to correlate with improvements in overall health and well-being.,,
10,to disprove,/d…™sňąpruv/,The scientist conducted experiments to disprove the theory.,,
11,to self-report,/ňĆs…õlf r…™ňąp…Ērt/,Participants in a research study may be asked to self-report their daily activities or feelings.,,
12,to verify,/ňąv…õr…ôňĆfa…™/,The software automatically verifies the integrity of the downloaded files.,,
13,apparatus,/ňĆ√¶p…ôňąr√¶t…ôs/,"The laboratory apparatus included microscopes, test tubes, and beakers.",,
14,carbon dating,/ňąk…Ďrb…ôn ňąde…™t…™Ňč/,"Carbon dating revealed that the ancient artifact was over 5,000 years old.",,
15,clinical trial,/ňąkl…™n…™k…ôl ňątra…™…ôl/,The new drug is currently undergoing a clinical trial to assess its safety and efficacy.,,
16,control,/k…ônňątro äl/,"In the experiment, the untreated plants served as the control to compare the effects of the new fertilizer.",,
17,guinea pig,/ňą…°…™ni p…™…°/,"The new drug is still in its testing phase, and they need volunteers to be guinea pigs for the clinical trials.",,
18,pseudoscience,/ňĆsudo äňąsa…™…ôns/,Astrology is often regarded as pseudoscience because its claims are not supported by empirical evidence.,,
19,subject,/ňąs ĆbňĆd í…õkt/,The subjects in the clinical trial were closely monitored for any adverse effects of the new medication.,,
20,treatise,/ňątrit…™s/,"Isaac Newton's ""Mathematical Principles of Natural Philosophy"" is a famous treatise on physics.",,
21,abstract,/ňą√¶bňĆstr√¶kt/,"Before attending the lecture, I skimmed through the abstract to get an idea of what the speaker would discuss.",,
22,thesis,/ňąőłis…™s/,"In the debate, Sarah presented the thesis that stricter gun control laws would lead to a decrease in gun-related violence.",,
23,literature,/ňąl…™t…ôr…ôňĆt É är/,The library contains a vast collection of literature on art history and theory.,,
24,citation,/sa…™ňąte…™ É…ôn/,"In academic writing, it is essential to provide proper citations for all sources used.",,
25,limitation,/ňĆl…™m…™ňąte…™ É…ôn/,"The study's findings were influenced by several limitations, including a small sample size.",,
26,methodology,/ňĆm…õőł…ôňąd…Ďl…ôd íi/,The researcher described the methodology used to gather data for the study.,,
27,randomization,/ňĆr√¶nd…ôm…ôňąze…™ É…ôn/,Randomization is used in clinical trials to assign participants to different treatment groups.,,
28,parameter,/p…ôňąr√¶m…™t…ôr/,The company policy sets strict parameters for employee conduct during business hours.,,
29,peer review,/ňąp…™r r…™ňĆvju/,The manuscript underwent rigorous peer review before being accepted for publication in the journal.,,
30,dissemination,/d…™ňĆs…õm…ôňąne…™ É…ôn/,Effective dissemination of educational materials can empower individuals and communities to make positive changes.,,
