容쯢rder,word,phonetic,example,note,definition_en
1,amateur,/틛칝m톛틟t톞r/,The garage band produced only amateur pop songs before gaining industry experience.,,
2,authentic,"/톛틛풪톝n톩k/, /톛틛풪톝nt톩k/, /톖틛풪톝n톩k/, /톖틛풪톝nt톩k/","The antique vase was confirmed as authentic by experts, ensuring its historical value.",,
3,decorative,/틛d톝k톷톛t톩v/,The decorative pillows on the sofa added a touch of elegance and color to the living room.,,
4,symbolic,/s톩m틛b톔톪톩k/,The dove is symbolic of peace and harmony across cultures and religions.,,
5,auction house,/틛톖틣k툮톛n h틛a툵s/,Christie's and Sotheby's are renowned auction houses known for selling fine art and collectibles to high-profile collectors worldwide.,,
6,bronze,/br톔nz/,The city erected a bronze in the town square to honor its founding fathers.,,
7,ceramic,/s톟틛칝m톩k/,"The museum displayed a wide array of ancient ceramics from different civilizations, showcasing their craftsmanship and cultural significance.",,
8,canvas,/틛k칝nv톛s/,"She displayed her latest canvas in the gallery, an abstract oil painting that evoked emotions of peace and introspection.",,
9,mural,/틛mj툵톷톛톪/,The city commissioned a local artist to create a vibrant mural depicting the history and culture of the neighborhood.,,
10,oil painting,/틛톖톩l p틛e톩nt톩콂/,"She studied the techniques of oil painting under a master artist, learning to blend colors and create depth on canvas.",,
11,silhouette,/틟s톩톪톛틛w톝t/,"She framed the silhouette of her daughter playing in the park, the simplicity of the outline capturing the essence of childhood joy.",,
12,still life,/st틛톩l l틛a톩f/,"The artist's still life painting depicted a bowl of fruit and a vase of flowers, capturing the play of light and shadow on the objects.",,
13,print,/pr톩nt/,She admired the intricate details of the Japanese woodblock print hanging in the art gallery.,,
14,depth,/d톝p풪/,"The artist used shading and perspective to create a sense of depth in the landscape painting, making the mountains appear distant and majestic.",,
15,finish,/틛f톩n톩툮/,She applied a clear finish to the freshly painted walls to protect them from stains and scratches.,,
16,harmony,/틛h톔rm톛ni/,"The painting exhibited a harmony of colors, with each hue blending seamlessly into the next.",,
17,patron,/틛pe톩t톷톛n/,"As a dedicated supporter of the cause, she became a patron of the animal shelter, making regular donations to provide care and medical treatment for rescued animals.",,
18,sculptor,/틛sk톛톪pt톟/,"The sculptor meticulously chiseled away at the marble block, transforming it into a lifelike statue of a historical figure.",,
19,palette,/틛p칝톪톛t/,"The artist's palette was covered in a colorful array of oil paints, each hue carefully mixed to capture the essence of the sunset.",,
20,reproduction,/틟톷ip톷톛틛d톛k툮톛n/,"The museum displayed a high-quality reproduction of the Mona Lisa, allowing visitors to admire Leonardo da Vinci's masterpiece up close.",,
21,restoration,/틟톷톝st톟틛e톩툮톛n/,"The restoration of the ancient frescoes took several years, with experts meticulously repairing and cleaning the artwork to reveal its original beauty.",,
22,viewpoint,/틛vju틟p톖톩nt/,"From her viewpoint, the new policy would greatly benefit small businesses by providing much-needed tax relief.",,
23,watercolor,/틛w톖t톟틟k톛톪톟/,"The artist's gallery featured a stunning watercolor of a serene lake at sunrise, with soft, blended hues creating a tranquil scene.",,
24,impressionism,/틟톩m틛p톷톝툮톛틟n톩z톛m/,"Claude Monet's ""Water Lilies"" is a quintessential example of Impressionism, capturing the ephemeral beauty of light and nature.",,
25,modernism,/틛m톔d톟틟n톩z톛m/,Modernism emerged in the early 20th century as artists and writers sought to break away from traditional forms and experiment with new techniques and perspectives.,,
26,realism,/틛톷i톛톪톩zm/,"The artist's commitment to realism is evident in his paintings, which meticulously depict the everyday lives of rural workers with incredible detail.",,
27,romanticism,/톷o툵틛m칝nt톛틟s톩z톛m/,"Romanticism emerged as a reaction against the industrial revolution and the Enlightenment, emphasizing the importance of emotion, nature, and individualism in art and literature.",,
28,surrealism,"/s톟틛i톛틟톪톩z톛m/, /s톟틛i톪톩z톛m/","Salvador Dal칤's ""The Persistence of Memory"" is one of the most famous works of surrealism, featuring melting clocks draped over a dreamlike landscape.",,
29,to carve,/틛k톔톷v/,He carved intricate patterns into the stone to create a decorative monument.,,
30,to mold,/틛mo툵톪d/,She carefully molded the clay into a beautiful vase on the potter's wheel.,,
31,to pose,/틛po툵z/,"The model posed gracefully, capturing the essence of elegance and sophistication in the fashion photoshoot.",,
32,to shade,/툮e톩d/,"She carefully shaded the apple in her drawing, using different pencil pressures to create depth and realism.",,
