order,word,phonetic,example,note,definition_en
1,to assure,/əˈʃʊɹ/,Success was now assured with the implementation of the new strategy.,,
2,to check on,/tʃˈɛk ˈɑːn/,She called her elderly neighbor every morning to check on her wellbeing and see if she needed any assistance.,,
3,to count on,/kˈaʊnt ˈɑːn/,You can count on me to help you with the project; I'm always here for support.,,
4,to presume,/pɹɪˈzum/,"Without clear evidence, she could only presume that the meeting would be rescheduled.",,
5,to toss,/ˈtɔs/,"We couldn't decide who should go first, so we tossed a coin.",,
6,to underestimate,"/ˈəndɝˈɛstəˌmeɪt/, /ˈəndɝˈɛstəmət/",She warned him not to underestimate the challenges of starting a new business from scratch.,,
7,to weaken,/ˈwikən/,"Despite her initial enthusiasm, her resolve began to weaken as the challenges of the project became apparent.",,
8,assured,/əˈʃʊɹd/,"She spoke with an assured tone, confident in her ability to lead the team to success.",,
9,concrete,"/ˈkɑnkɹit/, /kənˈkɹit/","In scientific research, it is crucial to provide concrete evidence to support hypotheses and conclusions.",,
10,doubtful,/ˈdaʊtfəl/,"Given the poor weather conditions, it's doubtful that the outdoor concert will take place as scheduled.",,
11,dubious,/ˈdubiəs/,"The online reviews of the restaurant were mixed, leaving us dubious about whether to dine there.",,
12,inconclusive,/ˌɪnkənˈkɫusɪv/,"The medical tests were inconclusive, so further examination is needed to determine the cause of the symptoms.",,
13,robust,/ɹoʊˈbəst/,The CEO's robust leadership style transformed the struggling company into an industry leader within a few years.,,
14,set,/sɛt/,"With all the decorations in place and the food ready, we were set for the party to begin.",,
15,skeptical,"/ˈskɛptəkəɫ/, /ˈskɛptɪkəɫ/","Despite the promising claims, Lisa remained skeptical about the new diet's effectiveness.",,
16,speculative,/ˈspɛkjəɫətɪv/,The article contained speculative theories about the origins of the universe.,,
17,suspected,/səˈspɛktɪd/,"The authorities evacuated the building due to a suspected gas leak, even though they hadn't detected any fumes.",,
18,tentative,"/ˈtɛnətɪv/, /ˈtɛntətɪv/","They reached a tentative agreement on the terms of the contract, pending further negotiation.",,
19,undeniable,/ˌəndɪˈnaɪəbəɫ/,"The impact of climate change on the environment is undeniable, as evidenced by rising temperatures and melting ice caps.",,
20,to [be] (only|just|) a matter of time,/biː ɐ mˈæɾɚɹ ʌv tˈaɪm/,"With the team's talent and dedication, it's a matter of time before they win the championship.",,
21,or what,/ɔːɹ wˈʌt/,"Is he coming to the meeting on time, or what?",,
22,to [stand] a chance,/stˈænd ɐ tʃˈæns/,She was so nervous during the interview that she didn't think she stood a chance of getting the job.,,
23,there [is] no question of,/ðɛɹ ɪz nˈoʊ kwˈɛstʃən ʌv/,There is no question of the project being postponed.,,
24,(you|one) can never tell,/juː ɔːɹ wˈʌn kæn nˈɛvɚ tˈɛl/,"In the ever-changing world of technology, you can never tell which new innovation will become the next big thing.",,
25,guesswork,/ˈɡɛsˌwɝk/,"In the absence of a calculator, I had to resort to guesswork to estimate the total cost of my purchases at the store.",,
26,hesitation,/ˌhɛzəˈteɪʃən/,"She felt a moment of hesitation before signing the contract, unsure if it was the right decision.",,
27,outlook,/ˈaʊtˌɫʊk/,"Despite facing challenges, she maintained a positive outlook on her career, believing that hard work would lead to success.",,
28,paradox,/ˈpɛɹəˌdɑks/,"It's a paradox that the more choices we have, the harder it becomes to make a decision.",,
29,uncertainty,/ənˈsɝtənti/,The financial market is full of uncertainties.,,
30,easily,/ˈiːzəli/,The fire could easily have spread to the neighboring buildings.,,
31,supposedly,/səˈpoʊzədɫi/,"She was supposedly the last person to leave the building, according to eyewitnesses.",,
32,as luck would have it,/æz lˈʌk wʊdhɐv ɪt/,"As luck would have it, I found my lost keys just before leaving the house.",,
33,bulletproof,/ˈbʊɫətˌpɹuf/,The new security system was designed to be virtually bulletproof against cyberattacks.,,
