ÔĽŅorder,word,phonetic,example,note,definition_en
1,war,/w…Ďr/,"The soldiers marched off to battle, prepared to defend their country in war.",,
2,peace,/piňźs/,"After years of conflict, the region finally experienced a period of lasting peace and stability.",,
3,army,/ňą…Ďrmi/,The army conducted exercises to improve its combat readiness.,,
4,military,/ňąm…™l…™ňĆt…õri/,The military conducted a series of training exercises near the border.,,
5,force,/f…Ērs/,The police force worked tirelessly to maintain law and order during the city-wide protests.,,
6,to obey,/o äňąbe…™/,Children are expected to obey their parents' instructions.,,
7,to order,/ňą…Ērd…ö/,The general ordered the troops to advance to the front lines.,,
8,order,/ňą…Ērd…ö/,The general issued a strict order to advance the troops.,,
9,commander,/k…ôňąm√¶nd…ö/,The commander briefed his team on the mission objectives and the strategic plan for the operation.,,
10,officer,/ňą…Ďf…™s…ö/,,,
11,conflict,/ňąk…Ďnfl…™kt/,The soldiers engaged in a brief conflict at the border.,,
12,battle,/ňąb√¶tl/,The decisive battle changed the course of the war.,,
13,to defeat,/d…™ňąfiňźt/,The army worked together to defeat the enemy in a decisive battle.,,
14,defeat,/d…™ňąfiňźt/,,,
15,attack,/…ôňąt√¶k/,The military launched a surprise attack on the enemy's base under the cover of darkness.,,
16,to attack,/…ôňąt√¶k/,The military decided to attack the enemy stronghold under the cover of darkness.,,
17,to defend,/d…™ňąf…õnd/,The brave soldier defended the country during the battle.,,
18,defense,/d…™ňąf…õns/,The nation increased its defense spending in response to regional tensions.,,
19,victory,/ňąv…™kt…ôri/,,,
20,to guard,/…°…Ďrd/,A dog is trained to guard the property and alert the owners to potential threats.,,
21,weapon,/ňąwep…ôn/,The soldier carried a rifle as his primary weapon during combat.,,
22,gun,/…° Ćn/,The sound of a gun firing echoed across the shooting range.,,
23,bullet,/ňąb äl…™t/,"The soldier loaded the bullet into his rifle, preparing for battle.",,
24,bomb,/b…Ďňźm/,"The bomb exploded in the crowded market, causing widespread panic and chaos.",,
25,to fire,/ňąfa…™…ö/,The police officer is firing rounds to disperse the crowd.,,
26,to explode,/…™kňąsplo äd/,"The fireworks exploded in the sky, lighting up the night.",,
27,to shoot,/ Éuňźt/,The police officer had to shoot to defend against the armed suspect.,,
28,explosion,/…™kňąsplo ä í…ôn/,The explosion at the factory was caused by a malfunction in the chemical storage tanks.,,
29,enemy,/ňą…õn…ômi/,"The enemy's stronghold was well-defended, presenting a daunting obstacle for the invading army to overcome.",,
30,to damage,/ňąd√¶m…™d í/,The storm's strong winds and hailstones damaged the roof of the house.,,
31,damage,/ňąd√¶m…™d í/,The hailstorm caused significant damage to the car's roof and windshield.,,
32,to bomb,/b…Ďňźm/,"The government accused the other country of bombing our embassy, leading to a diplomatic crisis.",,
33,peaceful,/ňąpiňźsf…ôl/,"The small village lived in peaceful isolation, untouched by the wars raging in surrounding lands.",,
34,bloody,/ňąbl Ćdi/,The historical battle was a bloody conflict that left a significant impact on the region.,,
35,dogfighter,/ňąd…Ď…°ňĆfa…™t…ö/,,,
36,to target,/ňąt…Ďr…°…™t/,The sniper carefully targeted the enemy officer from a concealed position.,,
37,destruction,/d…™ňąstr Ćk É…ôn/,The hurricane's destruction of the coastal town left many homes in ruins.,,
38,combat,"/ňąk…Ďmb√¶t/, /k…ômňąb√¶t/",The soldiers were trained for combat in harsh environments.,,
39,missile,/ňąm…™s…ôl/,,,
40,shotgun,/ňą É…ĎtňĆ…° Ćn/,,,
41,gunshot,/ňą…° ĆnňĆ É…Ďt/,"During the training session, the recruits practiced the proper technique for a controlled and accurate gunshot.",,
42,gunfire,/ňą…° ĆnňĆfa…™…Ě/,The soldiers took cover as the gunfire intensified from the opposing forces.,,
43,to question,/ňąkw…õs ß…ôn/,"During the job interview, the employer questioned the candidate about their relevant experience.",,
