容쯢rder,word,phonetic,example,note,definition_en
1,planet,/틛pl칝n톩t/,Jupiter is the largest planet in our solar system.,,
2,atmosphere,/틛칝tm톛s틟f톩r/,Earth's atmosphere protects us from harmful solar radiation.,,
3,habitat,/틛h칝b톩틟t칝t/,Coral reefs provide a rich habitat for thousands of marine species.,,
4,resource,/틛ri틟s톖rs/,"The country's natural resources include oil, natural gas, and minerals.",,
5,power,/틛pa툵톜/,The factory relies on solar power to run its production lines.,,
6,fuel,/틛fju틣톛l/,Wood is a common fuel for campfires.,,
7,fossil fuel,/틛f톔s톛l 틛fju틣톛l/,Burning fossil fuels releases carbon dioxide into the atmosphere.,,
8,coal,/ko툵l/,"Coal has been a crucial source of energy for centuries, playing a significant role in powering industries and generating electricity worldwide.",,
9,oil,/톖톩l/,,,
10,energy,/틛톝n톜퉋i/,,,
11,atomic energy,/톛틛t톔m톩k 틛톝n톜퉋i/,,,
12,carbon footprint,/틛k톔rb톛n 틛f툵t틟pr톩nt/,Flying frequently increases your carbon footprint significantly.,,
13,carbon dioxide,/틛k톔rb톛n da톩틛톔ksa톩d/,Breathing out releases carbon dioxide into the air.,,
14,clean,/kli틣n/,The reactor was designed to allow a clean shutdown in emergencies.,,
15,cleanup,/틛kli틣n틟툷p/,,,
16,eco-friendly,"/틟i틣ko툵틛fr톝ndli/ , /틟톝ko툵틛fr톝ndli/",The company switched to eco-friendly packaging made from recycled materials.,,
17,green,/토ri틣n/,The company prides itself on producing green packaging that reduces waste.,,
18,to pollute,/p톛틛lu틣t/,Factories often pollute the air with emissions from burning fossil fuels.,,
19,to consume,/k톛n틛su틣m/,"During the winter months, households tend to consume more energy for heating to stay warm.",,
20,climate crisis,/틛kla톩m톛t 틛kra톩s톩s/,,,
21,natural disaster,/틛n칝t툮r톛l d톩틛z칝st톜/,"The city was devastated by a natural disaster, leaving many homeless.",,
22,volcanic eruption,/v톔l틛k칝n톩k 톩틛r툷p툮톛n/,The volcanic eruption sent ash clouds high into the sky.,,
23,garbage,/틛토톔rb톩퉋/,He threw the garbage into the bin after dinner.,,
24,waste,/we톩st/,"Recycling helps to reduce the amount of waste sent to landfills by reusing materials such as paper, glass, and plastic.",,
25,greenhouse gas,/틛토ri틣n틟ha툵s 토칝s/,Carbon dioxide is a major greenhouse gas responsible for global warming.,,
26,greenhouse effect,/틛토ri틣n틟ha툵s 톩틛f톝kt/,"The greenhouse effect is a natural phenomenon vital for sustaining life on Earth, but the enhanced greenhouse effect caused by human activities has accelerated climate change and its associated impacts.",,
27,toxic,/틛t톔ks톩k/,The toxic fumes emitted by the factory posed a serious threat to the health of nearby residents.,,
28,poisonous,/틛p톖톩z톛n톛s/,Be careful around those brightly colored mushrooms they arepoisonous!,,
29,air pollution,/톝r p톛틛lu틣툮톛n/,The heavy air pollution made it difficult to breathe and caused itchy eyes for many residents.,,
30,smoke,/smo툵k/,Smoke rose from the chimney as the fire burned inside.,,
31,power plant,/틛pa툵톜 pl칝nt/,The massive hydroelectric power plant harnessed the power of the rushing river to generate clean electricity.,,
32,to recycle,/ri틛sa톩k톛l/,Recycling paper involves collecting and processing used paper products to make new paper.,,
33,recycling,/ri틛sa톩kl톩콂/,Recycling helps reduce environmental pollution.,,
34,renewable,"/r톩틛nu틣톛b톛l/ , /r톩틛nju틣톛b톛l/",Solar energy is a renewable resource that is continuously replenished by the sun's rays.,,
35,emergency,/톩틛m톟틣퉋톛nsi/,The lifeguard quickly responded to the emergency when a swimmer began struggling in the water.,,
36,to rot,/r톔t/,"If not refrigerated, food can quickly rot.",verb,
37,filth,/f톩l풪/,"The abandoned building was overrun with filth, its floors littered with garbage and its walls coated in layers of grime.",,
38,to rot,/r톔t/,"The damp conditions in the basement rotted the wooden beams, causing structural damage to the house.",verb,
