ÔĽŅorder,word,phonetic,example,note,definition_en
1,nature,/ňąne…™t É…ö/,,,
2,individual,/ňĆ…™nd…ôňąv…™d íu…ôl/,Each individual in the team brings unique skills and perspectives to the project.,,
3,horrible,/ňąh…Ďr…™b…ôl/,,,
4,dependent,/d…™ňąp…õnd…ônt/,The success of the project was highly dependent on the team's ability to collaborate effectively.,,
5,organized,/ňą…Ēr…°…ôňĆna…™zd/,She is very organized and always finishes her work on time.,,
6,outgoing,/ňąa ätňĆ…°o ä…™Ňč/,The outgoing student eagerly participated in group activities and made friends easily.,,
7,to pretend,/pr…™ňąt…õnd/,"He pretended to enjoy the meal, even though it didn't taste good, to avoid causing offense.",,
8,quality,/ňąkw…Ďl…ôti/,Generosity is a defining quality of his character.,,
9,characteristic,/ňĆk…õr…ôkt…öňą…™st…™k/,Her kindness is a characteristic everyone notices.,,
10,personal,/ňąp…Ěňźs…ôn…ôl/,She kept her personal diary hidden under her bed.,,
11,relaxed,/r…™ňąl√¶kst/,"After a long day at work, he enjoys taking a hot bath to feel relaxed and unwind.",,
12,easy,/ňąiňźzi/,"Despite the stressful situation, she remained calm and easy, effortlessly navigating the challenges.",,
13,reliable,/r…™ňąla…™…ôb…ôl/,"He's reliable, always delivering on his promises and consistently producing quality work.",,
14,wise,/wa…™z/,Grandparents are often considered wise because of their life experiences and wisdom.,,
15,slow,/slo ä/,"Her brother teased her for being slow, but she remained determined to improve her skills.",,
16,to trick,/tr…™k/,He tricked his brother into giving him the last piece of cake by pretending it was his birthday.,,
17,weak,/wiňźk/,"Sarah's weak character was evident in her tendency to change her mind frequently, unable to stand firm in her decisions.",,
18,mean,/miňźn/,The mean girl spread rumors about her classmates to make herself feel superior.,,
19,childish,/ňą ßa…™ld…™ É/,"Instead of resolving their issues maturely, they resorted to childish name-calling and insults.",,
20,loyal,/ňąl…Ē…™…ôl/,"The loyal friend stood by his side through thick and thin, offering unwavering support.",,
21,open,/ňąo äp…ôn/,She has an open attitude and is always willing to discuss any issues that arise.,,
22,evil,/ňąiňźv…ôl/,The evil villain cackled with delight as he watched the hero struggle.,,
23,responsible,/r…™ňąsp…Ďns…™b…ôl/,"She is a responsible pet owner, ensuring her animals are well-cared for and loved.",,
24,mysterious,/m…™sňąt…™ri…ôs/,"The new neighbor was mysterious, rarely seen and hardly speaking to anyone.",,
25,determined,/d…™ňąt…Ěňźm…™nd/,"She was determined to finish the marathon, despite the pain in her legs.",,
26,concern,/k…ônňąs…Ěňźn/,Her voice trembled with concern as she asked about his recent accident.,,
27,to appreciate,/…ôňąpriňź ÉiňĆe…™t/,She regularly appreciates the support of her friends during challenging times.,,
