ÔĽŅorder,word,phonetic,example,note,definition_en
1,to credit,/ňąkr…õd…™t/,The employer credited the employee's salary to their bank account at the end of each month.,,
2,economy,"/iňąk…Ďn…ômi/, /…™ňąk…Ďn…ômi/",The country's economy grew rapidly due to investments in technology and infrastructure.,,
3,economic,"/ňĆ…õk…ôňąn…Ďm…™k/, /ňĆik…ôňąn…Ďm…™k/",Rising unemployment rates were a major economic concern during the recession.,,
4,accounting,/…ôňąka änt…™Ňč/,The accounting department prepares financial statements such as the balance sheet and income statement to reflect the financial position and performance of the company.,,
5,asset,/ňą√¶ňĆs…õt/,Real estate is considered a valuable asset due to its potential for long-term appreciation and rental income.,,
6,budget,/ňąb Ćd í…™t/,The project has a strict budget for equipment.,,
7,capital,"/ňąk√¶p…ôt…ô…ę/, /ňąk√¶p…™t…ô…ę/",The company invested capital in new machinery.,,
8,debit,/ňąd…õb…™t/,The accountant recorded the purchase as a debit.,,
9,finance,"/ňąfa…™n√¶ns/ , /f…™ňąn√¶ns/",Poor finance planning led to the company's bankruptcy.,,
10,investment,"/ňĆ…™nňąv…õsm…ônt/, /ňĆ…™nňąv…õstm…ônt/","She made a significant investment in stocks, hoping to see substantial returns over the next few years.",,
11,financing,"/fa…™ňąn√¶ns…™Ňč/, /f…ôňąn√¶ns…™Ňč/, /f…™ňąn√¶ns…™Ňč/",Government financing supports infrastructure projects like road construction and public transportation improvements.,,
12,borrowing,/ňąb…Ď…Ļo ä…™Ňč/,Borrowing allows individuals and organizations to access capital they need for investments or expenses without needing to liquidate existing assets.,,
13,debt,/d…õt/,She fell into debt after medical expenses.,,
14,grant,/ňą…°…Ļ√¶nt/,The research team received a grant to fund their study on renewable energy.,,
15,loan,/ňą…ęo än/,"She took out a loan to buy her first home, which she plans to repay over 30 years.",,
16,to possess,/p…ôňąz…õs/,"As an avid art collector, he possesses valuable paintings from renowned artists.",,
17,distribution,/ňĆd…™st…Ļ…ôbňąju É…ôn/,The company improved its distribution network to ensure products reach stores faster.,,
18,inflation,/ňĆ…™nňąf…ęe…™ É…ôn/,High inflation reduces the purchasing power of consumers.,,
19,welfare,/ňąw…õlňĆf…õr/,The government increased welfare benefits to support families during the economic downturn.,,
20,profit,"/ňąp…Ļ…Ďf…ôt/, /ňąp…Ļ…Ďf…™t/","The company reported a significant profit for the fiscal year, reflecting efficient operations and strong sales.",,
21,standard of living,/stňą√¶nd…öd  Ćv lňą…™v…™Ňč/,Improved infrastructure and healthcare services have contributed to a higher standard of living in urban areas.,,
22,balance,/ňąb√¶l…ôns/,"After reconciling the books, the accountant confirmed the balance was zero.",,
23,bank statement,/bňą√¶Ňčk stňąe…™tm…ônt/,John reviewed his bank statement to reconcile his records with his monthly expenses.,,
24,collapse,/k…ôňąl√¶ps/,The financial collapse led to widespread panic among investors.,,
25,to collapse,/k…ôňąl√¶ps/,The stock market collapsed after the unexpected economic report was released.,,
26,decrease,/d…™ňąkriňźs/,The population saw a decrease of 5% this year.,,
27,loss,/ňą…ę…Ēs/,The business reported a significant loss for the quarter due to declining sales.,,
28,analyst,/ňą√¶n…ô…ę…™st/,The market analyst predicted a surge in stock prices based on recent economic indicators.,,
29,banker,/ňąb√¶Ňčk…Ě/,"As a banker, she oversees the lending operations and financial services offered to clients.",,
30,to price,/pra…™s/,Businesses carefully price their products to remain competitive in the market.,,
31,to purchase,/ňąp…Ět É…ôs/,Consumers often purchase goods and services to meet their needs and desires.,,
32,rate,/ňą…Ļe…™t/,The bank offers a competitive interest rate on savings accounts.,,
33,to rip off,/…Ļňą…™p ňą…Ēf/,The store ripped off customers by selling counterfeit designer handbags at full price.,,
34,rip-off,/…Ļňą…™pňą…Ēf/,"The concert tickets were a complete rip-off, costing twice as much as last year.",,
35,bull,/b äl/,"The bull invested heavily in tech stocks, confident that their prices would surge in the coming months.",,
36,bear,/b…õr/,"As a seasoned bear, he often profited from falling commodity prices.",,
37,to run out,/…Ļňą Ćn ňąa ät/,The restaurant unexpectedly ran out of the popular dish.,,
38,automated teller machine,/ňĆ…Ēňź…ĺ…ômňą√¶…ĺ…™k tňą…õl…ö m…ô Éňąiňźn/,The bank installed a new ATM in the shopping mall.,,
39,refund,"/ňą…ĻiňĆf…ônd/, /…Ļ…™ňąf…ônd/",She received a full refund after returning the defective shoes.,,
