ÔĽŅorder,word,phonetic,example,note,definition_en
1,institution,/ňĆ…™nst…™ňątu É…ôn/,The university is a well-respected institution known for its research programs.,,
2,grade school,/…°…Ļňąe…™d skňąuňźl/,"Grade school students often participate in various activities like art, music, and physical education.",,
3,graduate school,/…°…Ļňą√¶d íuňź…ôt skňąuňźl/,"After completing her undergraduate studies, she decided to apply to graduate school.",,
4,junior high school,/d íňąuňźnj…ö hňąa…™ skňąuňźl/,Junior high school students often experience significant social and academic transitions compared to elementary school.,,
5,senior high school,/sňąiňźnj…ö hňąa…™ skňąuňźl/,Senior high school students often undertake advanced coursework and specialized subjects to prepare for college or vocational training.,,
6,summer school,/sňą Ćm…ö skňąuňźl/,She attended summer school to retake a class and improve her GPA.,,
7,prom,/ňąp…Ļ…Ďm/,The students spent weeks preparing for their senior prom.,,
8,to enroll,"/…õnňą…Ļo ä…ę/, /…™nňą…Ļo ä…ę/",Students need to enroll in the classes for the upcoming semester.,,
9,to register,/ňąr…õ §…™st…ö/,She decided to register for the online course to improve her skills.,,
10,locker,/ňą…ę…Ďk…Ě/,She stored her books and backpack in her locker before heading to class.,,
11,roommate,/ňą…ĻuňĆme…™t/,She met her roommate on the first day of college and they quickly became friends.,,
12,discipline,/ňąd…™s…ôp…ę…ôn/,Effective discipline in the classroom helps maintain order and promotes a conducive learning environment.,,
13,major,/ňąme…™d í…ö/,She is a biology major with a minor in chemistry.,,
14,certificate,/s…Ěňąt…™f…™k…ôt/,She received a certificate of completion after finishing the online training.,,
15,master,/ňąm√¶st…ôr/,She became a master in engineering after completing her graduate studies.,,
16,to master,/ňąm√¶st…ôr/,The chef took the time to master the art of creating intricate desserts.,,
17,Doctor of Philosophy,/dňą…Ďňźkt…ö…Ļ  Ćv f…™lňą…Ďňźs…ôfi/,She earned her Doctor of Philosophy in neuroscience after six years of rigorous research.,,
18,postgraduate,/pňąo äst…°…Ļ…źd íňĆuňźe…™t/,She decided to continue her education as a postgraduate to earn a master's degree in psychology.,,
19,sponsor,/ňąsp…Ďns…Ě/,He found a sponsor who would cover his tuition fees and living expenses.,,
20,trainee,/ňąt…Ļe…™ňąni/,The company hired five new trainees this month.,,
21,to tutor,/ňątuňźt…ö/,She decided to tutor her classmates in chemistry to help them prepare for the upcoming exam.,,
22,thesis,/ňąőłis…™s/,"She spent months conducting experiments and analyzing data for her thesis, which was an essential part of her university degree in chemistry.",,
23,scholarship,/ňąsk…Ď…ę…ĚňĆ É…™p/,She received a full scholarship to study medicine at a prestigious university.,,
24,seminar,/ňąs…õm…ôňĆn…Ď…Ļ/,The seminar focused on contemporary issues in international law.,,
25,curriculum,/k…Ěňą…™kj…ô…ę…ôm/,"The school's curriculum includes core subjects like math, science, and language arts, as well as elective courses in arts and music.",,
26,optional,"/ňą…Ďp É…ôn…ô…ę/, /ňą…Ēp É…ôn…ô…ę/","The final project is optional, but many students choose to complete it for extra credit.",,
27,to grade,/…°re…™d/,The teacher spent the weekend grading her students' essays.,,
28,coursework,/ňąk…Ē…ĻsňĆw…Ěk/,"She spent hours completing her coursework for the biology class, including lab reports and research papers.",,
29,textbook,/ňąt…õkstňĆb äk/,The textbook for the biology course is quite comprehensive.,,
30,workbook,/ňąw…ĚkňĆb äk/,The teacher assigned several pages from the workbook for homework.,,
31,multiple-choice,/mňą Ćlt…™p…ôlt Éňą…Ē…™s/,The exam consisted mainly of multiple-choice questions.,,
32,tutorial,/tuňąt…Ē…Ļi…ô…ę/,She attended a tutorial on essay writing to improve her academic writing skills.,,
33,dormitory,/ňąd…Ē…Ļm…ôňĆt…Ē…Ļi/,The university built a new dorm to accommodate the growing number of students.,,
34,buttery,/ňąb…ôt…Ěi/,The buttery offers a variety of snacks and beverages for students between classes.,,
