ÔĽŅorder,word,phonetic,example,note,definition_en
1,adorable,/…ôňąd…Ē…Ļ…ôb…ô…ę/,"The adorable baby giggled and cooed, bringing joy to everyone around.",,
2,beloved,"/b…™ňą…ę…ôvd/, /b…™ňą…ę…ôv…ôd/",The author‚Äôs beloved novels have been enjoyed by readers for generations.,,
3,committed,/k…ôňąm…™t…™d/,"They were in a committed relationship, devoted to each other's happiness and well-being.",,
4,enchanted,"/…õnňąt É√¶n…™d/, /…õnňąt É√¶nt…™d/",The children were enchanted by the fairy tale's mystical creatures and enchanted forests.,,
5,hot,/h…Ďňźt/,She found herself drawn to him because she thought he was hot.,,
6,loved,/ňą…ę…ôvd/,She felt loved and appreciated by her family on her birthday.,,
7,loving,/ňą…ę…ôv…™Ňč/,"She's loving, always showing kindness and warmth to those around her.",,
8,lovesick,/lňą Ćvs…™k/,She was lovesick and couldn't stop thinking about him after their first date.,,
9,admirer,/√¶dňąma…™…Ļ…Ě/,She received a bouquet of flowers from a secret admirer.,,
10,(other|better) half,/ňą Ć√į…ö…Ļ …Ēňź…Ļ bňą…õ…ĺ…ö hňą√¶f/,"As soon as they met, they knew they had found their other half and embarked on a lifelong journey together.",,
11,lovebirds,/ňąl ĆvňĆb…Ědz/,"The lovebirds enjoyed a quiet evening together, holding hands and sharing laughs.",,
12,significant other,/s…™…°nňą…™f…™k…ônt ňą Ć√į…ö/,She introduced her significant other to her family at the holiday gathering.,,
13,anniversary,/ňĆ√¶n…ôňąv…Ěs…Ěi/,They celebrated their first wedding anniversary with a romantic dinner.,,
14,bridegroom,/ňąb…Ļa…™dňĆ…°…Ļum/,The bridegroom was nervous but excited as he waited at the altar.,,
15,to propose,/pr…ôňąpo äz/,"On a beautiful evening, he chose to propose to his girlfriend with a ring.",,
16,proposal,/p…Ļ…ôňąpo äz…ô…ę/,He surprised her with a romantic proposal at sunset on the beach.,,
17,broken heart,/b…Ļňąo äk…ôn hňą…Ďňź…Ļt/,"After their long-term relationship ended, she was left with a broken heart and struggled to move on.",,
18,date,/de…™t/,She was excited about her date with him at the new Italian restaurant.,,
19,eye candy,/ňąa…™ kňą√¶ndi/,"The movie was filled with special effects and eye candy, but the plot was weak.",,
20,Prince Charming,/p…Ļňą…™ns t Éňą…Ďňź…Ļm…™Ňč/,"She always dreamed of finding her Prince Charming, but real love is more complicated.",,
21,love affair,/lňą Ćv …źfňą…õ…Ļ/,They embarked on a passionate love affair that took them on adventures around the world.,,
22,passion,/ňąp√¶ É…ôn/,His passion for music led him to spend countless hours practicing and composing songs.,,
23,puppy love,/pňą Ćpi lňą Ćv/,Their puppy love quickly faded as they grew older and went their separate ways.,,
24,Valentine,/ňąv√¶l…ônňĆta…™n/,She received a mysterious Valentine with a sweet poem but no signature.,,
25,to adore,/…ôňąd…Ē…Ļ/,She adores her grandmother for her wisdom and kindness.,,
26,to ask out,/ňą√¶sk ňąa ät/,"I asked her out to dinner, and she said yes!",,
27,to [fall] in love,/fňą…Ēňźl …™n lňą Ćv/,They met at a coffee shop and quickly fell in love.,,
28,to go out,/…°o ä ňąa ät/,They started going out in college and have been a couple ever since.,,
29,to woo,/ňąwu/,"He tried to woo her with flowers and heartfelt letters, hoping to win her heart.",,
30,to hook up,/hňą äk ňą Ćp/,They hooked up at the party after getting to know each other.,,
31,to [have] a crush on {sb},/h√¶v …ź k…Ļňą Ć É ňĆ…Ďňźn ňĆ…õsbňąiňź/,Did she have a crush on Ryan?,,
32,hickey,/ňąh…™ki/,She had a noticeable hickey on her neck after their passionate embrace.,,
