ÔĽŅorder,word,phonetic,example,note,definition_en
1,alien,/ňąe…™li…ôn/,"The idea of aliens visiting Earth has been a topic of debate and speculation, with various reports and sightings fueling conspiracy theories.",,
2,space,/ňąspe…™s/,Astronauts trained for travel in space.,,
3,outer space,/ňąa ä…ĺ…ö spňąe…™s/,"Outer space is characterized by the absence of air, so astronauts must wear spacesuits to survive the vacuum and extreme conditions.",,
4,universe,/ňąjun…ôňĆv…Ěs/,Astronomers study distant galaxies to understand the vastness and complexity of the universe.,,
5,asteroid,/ňą√¶st…ĚňĆ…Ē…™d/,Scientists study asteroids to learn about the early solar system and potential threats to Earth.,,
6,black hole,/blňą√¶k hňąo äl/,Black holes are formed from the remnants of massive stars that have ended their life cycles and collapsed under their own gravity.,,
7,galaxy,/ňą…°√¶…ę…ôksi/,"Galaxies can vary in shape and size, with types including spiral, elliptical, and irregular galaxies, each having distinct structures and characteristics.",,
8,solar system,/sňąo äl…ö sňą…™st…ôm/,Earth is one of eight planets in the solar system.,,
9,Mercury,/ňąm…Ěkj…Ěi/,"Mercury, the closest planet to the Sun, has surface temperatures that can reach up to 800 degrees Fahrenheit during the day.",,
10,Venus,/vňąiňźn…ôs/,"Venus, often called the ""morning star"" or ""evening star,"" is the brightest natural object in the night sky after the Moon.",,
11,Mars,/mňą…Ďňź…Ļz/,Mars has fascinated astronomers for centuries due to its distinct reddish hue visible from Earth.,,
12,Jupiter,/d íňąuňźp…™…ĺ…ö/,Jupiter is the fifth planet from the sun in the solar system.,,
13,Saturn,/sňą√¶…ĺ…úňźn/,"Saturn is the second-largest planet in the solar system, after Jupiter, and has a diameter about 9 times that of Earth.",,
14,Uranus,/jňą ä…Ļ√¶n…ôs/,"The Voyager 2 spacecraft flew by Uranus in 1986, providing the first close-up images and data about its rings and moons.",,
15,Neptune,/nňą…õptuňźn/,"Neptune‚Äôs vibrant blue color is due to the presence of methane in its atmosphere, which absorbs red light.",,
16,astronomy,/…ôňąst…Ļ…Ďn…ômi/,Advances in astronomy have led to the discovery of exoplanets orbiting other stars in our galaxy.,,
17,astronomer,/…ôňąst…Ļ…Ďn…ôm…Ě/,The astronomer discovered a new exoplanet using advanced telescope technology.,,
18,landing,/ňą…ę√¶nd…™Ňč/,The astronauts successfully completed the landing on the surface of the Moon.,,
19,outer,/ňąa ät…Ě/,The outer coating of the tablet protects it from moisture until it reaches the stomach.,,
20,orbit,/ňą…Ē…Ļb…ôt/,The satellite was placed into a stable orbit to continuously monitor weather patterns from space.,,
21,to orbit,/ňą…Ē…Ļb…ôt/,The moon orbits around the Earth once every 27.3 days.,,
22,rocket,/ňą…Ļ…Ďk…ôt/,"The rocket lifted off from the launch pad, carrying a satellite into orbit around Earth.",,
23,satellite,/ňąs√¶t…ôňĆ…ęa…™t/,The weather satellite provided real-time images of storm systems to help meteorologists forecast the weather.,,
24,to launch,/ňą…ę…Ēnt É/,The military launched a missile as part of a test exercise.,,
25,takeoff,/ňąte…™ňĆk…Ēf/,"The plane‚Äôs takeoff was smooth, and passengers were soon enjoying the view from above the clouds.",,
26,spacecraft,/ňąspe…™sňĆk…Ļ√¶ft/,The spacecraft was launched to explore Mars and collect data about the planet's surface and atmosphere.,,
27,spaceman,/spňąe…™sm…ôn/,The spaceman conducted scientific experiments in space to study the effects of microgravity on various materials.,,
28,spaceship,/ňąspe…™sňĆ É…™p/,Scientists are working on developing reusable spaceships to reduce the cost of space exploration.,,
29,space station,/spňąe…™s stňąe…™ É…ôn/,The space station serves as a platform for testing technologies needed for future deep-space exploration.,,
30,spacesuit,/ňąspe…™ňĆsut/,"During training, astronauts practiced maneuvering in their spacesuits to become accustomed to the added bulk.",,
31,spacewalk,/ňąspe…™ňĆsw…Ďk/,The astronauts conducted a spacewalk to repair the solar panels on the International Space Station.,,
32,telescope,/ňąt…õ…ę…ôňĆsko äp/,He used a telescope to observe the stars.,,
33,voyage,"/ňąv…Ē…™…ôd í/, /ňąv…Ē…™…™d í/",The space mission was a historic voyage to the International Space Station.,,
