ÔĽŅorder,word,phonetic,example,note,definition_en
1,aerobics,/…Ěňąo äb…™ks/,"The instructor led a session of high-energy aerobics, including jumping jacks and step exercises.",,
2,athletic,/√¶őłňąl…õt…™k/,The athletic competition drew athletes from across the country to compete in various events.,,
3,locker room,/lňą…Ďňźk…ö …Ļňąuňźm/,The football players gathered in the locker room to discuss strategy before the big game.,,
4,barbell,/ňąb…ĎrňĆbel/,He performed squats with a barbell across his shoulders to target his leg and lower body muscles.,,
5,dumbbell,/ňąd…ômňĆb…õ…ę/,He lifted a pair of dumbbells during his workout to build muscle and increase strength.,,
6,cross trainer,/k…Ļňą…Ēs t…Ļňąe…™n…ö/,She prefers using the cross trainer at the gym for a low-impact cardio workout.,,
7,horizontal bar,/hňĆ…Ēňź…Ļ…™zňą…Ďňźnt…ôl bňą…Ďňź…Ļ/,"Gymnasts practice their routines on the horizontal bar, showcasing their strength and agility.",,
8,jump rope,/d íňą Ćmp …Ļňąo äp/,"Every morning, Sarah spends ten minutes using her jump rope to start her day with some cardio exercise.",,
9,mat,/ňąm√¶t/,"After the workout, he rolled up the mat and stored it in the designated area for exercise equipment.",,
10,multigym,/mňą Ćlt…™d íňĆ…™m/,"The home gym was equipped with a multigym that included a bench press, leg press, and pull-down machine.",,
11,pommel horse,/pňą…Ďňźm…ôl hňą…Ēňź…Ļs/,"The gymnast performed a flawless routine on the pommel horse, showcasing his strength and agility.",,
12,rowing machine,/…Ļňąo ä…™Ňč m…ô Éňąiňźn/,Lisa uses the rowing machine at the gym to improve her cardiovascular fitness and build muscle strength.,,
13,punching bag,/pňą Ćnt É…™Ňč bňą√¶…°/,The boxer spent hours training with the punching bag to perfect his jabs and hooks.,,
14,trampoline,/ňĆt…Ļ√¶mp…ôňą…ęin/,The children spent the afternoon bouncing on the trampoline in the backyard.,,
15,treadmill,/ňąt…Ļ…õdňĆm…™…ę/,"She used the treadmill at the gym for her daily cardio workout, setting a steady pace for 30 minutes.",,
16,to bounce,/ňąba äns/,The kids couldn't contain their excitement as they began to bounce on the trampoline in the backyard.,,
17,to hop,/ňąh…Ďp/,"During the sack race, the children had to hop to the finish line with one leg inside the sack.",,
18,to stretch,/ňąst…Ļ…õt É/,"Every morning, she begins her day with a series of yoga poses to stretch her body and improve flexibility.",,
19,to strengthen,/ňąst…Ļ…õŇčőł…ôn/,Regular exercise can strengthen your muscles and improve overall fitness.,,
20,to squat,/ňąskw…Ďt/,"During the workout, the fitness instructor demonstrated how to squat properly.",,
21,to sweat,/ňąsw…õt/,"After a long run, he began to sweat profusely.",,
22,chin-up,/t Éňą…™nňą Ćp/,He did ten chin-ups in a row as part of his daily workout routine.,,
23,push-up,/ňąp äňĆ É…ôp/,She performed a series of push-ups to build upper body strength and improve her fitness.,,
24,sit-up,/sňą…™tňą Ćp/,She performed a set of sit-ups to strengthen her abdominal muscles during her workout.,,
25,jumping jack,/d íňą Ćmp…™Ňč d íňą√¶k/,The warm-up routine began with a set of jumping jacks to get everyone's heart rates up.,,
26,to massage,/m…ôňąs…Ď í/,"The spa therapist used aromatic oils to massage the client's back, promoting relaxation.",,
27,muscle memory,/mňą Ćs…ôl mňą…õm…ö…Ļi/,"After a few weeks away from the gym, she found that her muscle memory helped her quickly return to her previous lifting weights.",,
28,six-pack,/ňąs…™kňĆsp√¶k/,The athlete worked hard on his core exercises to achieve a well-defined six-pack.,,
29,martial arts,/mňą…Ďňź…Ļ É…ôl ňą…Ďňź…Ļt/,"He has been studying martial arts since he was a child, starting with karate and later branching out into jiu-jitsu.",,
30,to weight-lift,/wňąe…™tlňą…™ft/,He weight-lifts at the gym three times a week to build muscle.,,
31,to work out,/wňą…úňźk ňąa ät/,I work out with a friend to make the exercise routine more enjoyable.,,
32,pace,/ňąpe…™s/,"The runner maintained a steady pace throughout the marathon, ensuring they did not tire out too quickly.",,
33,to burn off,/bňą…úňźn ňą…Ēf/,Swimming is a full-body exercise that can help burn off calories efficiently.,,
34,dressing room,/ňądr…õs…™Ňč ňĆrum/,"The gym's dressing room was equipped with lockers and benches, making it convenient for members to change and store their belongings.",,
35,pound for pound,/pňąa änd f…Ēňź…Ļ pňąa änd/,"Pound for pound, she's one of the strongest athletes on the team.",,
