ÔĽŅorder,word,phonetic,example,note,definition_en
1,to acknowledge,/√¶kňąn…Ď…ę…™d í/,"For the therapy to be effective, one must first acknowledge their feelings and emotions.",,
2,to aid,/ňąe…™d/,The organization aids communities affected by natural disasters.,,
3,age limit,/ňąe…™d í lňą…™m…™t/,There's an age limit of 21 years for purchasing alcohol in this country.,,
4,ban,/b√¶n/,The government announced a ban on single-use plastic bags to reduce environmental pollution.,,
5,to bar,/b…Ďr/,Failure to meet the academic requirements could bar a student from participating in certain school activities.,,
6,condition,/k…ônňąd…™ É…ôn/,The loan was approved on the condition that the borrower provided collateral.,,
7,to demand,/d…™ňąm√¶nd/,The workers decided to demand higher wages and better working conditions during the negotiations.,,
8,to enable,"/…õňąne…™b…ô…ę/, /…™ňąne…™b…ô…ę/",Technology enables us to communicate instantly across the globe.,,
9,exception,/…™kňąs…õp É…ôn/,"The school generally does not allow cell phones in class, but there is an exception for students with special needs.",,
10,guideline,/ňą…°a…™dňĆ…ęa…™n/,The company's dress code guidelines specify business casual attire for all employees.,,
11,necessity,"/n…ôňąs…õs…ôti/, /n…ôňąs…õs…™ti/","In many jobs, having a reliable internet connection is a necessity for performing daily tasks effectively.",,
12,permit,"/ňąp…ĚňĆm…™t/, /p…Ěňąm…™t/","You need a permit to build a new structure on your property, which you can obtain from the local planning office.",,
13,to permit,"/ňąp…ĚňĆm…™t/, /p…Ěňąm…™t/",The park permits visitors to bring their own food and drinks.,,
14,regulation,/ňĆ…Ļ…õ…°j…ôňą…ęe…™ É…ôn/,The new regulations require all vehicles to undergo emissions testing annually.,,
15,obligation,/ňĆ…Ďb…ę…ôňą…°e…™ É…ôn/,Paying taxes is a civic obligation that supports public services and infrastructure.,,
16,requirement,/…Ļ…™ňąkwa…™…Ļm…ônt/,Water is a basic requirement for life.,,
17,to restrict,/…Ļiňąst…Ļ…™kt/,The school decided to restrict access to certain areas for student safety.,,
18,restriction,/…Ļiňąst…Ļ…™k É…ôn/,The new policy included a restriction on the amount of vacation time employees could take in a year.,,
19,rule book,/…Ļňąuňźl bňą äk/,"Before starting the tournament, each participant received a copy of the rule book outlining the competition's regulations.",,
20,to forbid,"/f…Ěňąb…™d/, /f…Ēňąb…™d/",The teacher forbade talking during the exam.,,
21,forbidden,"/ňąf…Ē…Ļb…™d…ôn/, /f…Ě…Ļňąb…™d…ôn/",Smoking is forbidden in this area to maintain clean air quality.,,
22,acceptable,"/√¶kňąs…õpt…ôb…ô…ę/, /…ôkňąs…õpt…ôb…ô…ę/",It is considered acceptable to tip service workers in many countries as a sign of appreciation for good service.,,
23,to grant,/ňą…°…Ļ√¶nt/,The teacher decided to grant extra time for students to complete their assignments.,,
24,compulsory,/k…ômňąp…ô…ęs…Ěi/,Attendance at the safety training session is compulsory for all employees.,,
25,illegal,/ňĆ…™ňą…ęi…°…ô…ę/,Selling drugs on the street is illegal and punishable by law.,,
26,mandatory,/ňąm√¶nd…ôňĆt…Ē…Ļi/,Wearing a face mask in public places is mandatory to prevent the spread of the virus.,,
27,to impose,/ňĆ…™mňąpo äz/,The authoritarian government tried to impose strict regulations on freedom of speech.,,
28,to insist,/ňĆ…™nňąs…™st/,"She insisted on paying for dinner, despite our protests.",,
29,strictness,/st…Ļňą…™ktn…ôs/,The teacher's strictness ensured that all students followed classroom rules.,,
30,sanction,/ňąs√¶Ňčk É…ôn/,The government imposed economic sanctions on the country for violating international agreements.,,
31,provided that,/p…Ļ…ôvňąa…™dŠĶĽd √įňą√¶t/,"She agreed to lend him the money, provided that he pays it back within a month.",,
32,to beg,/ňąb…õ…°/,"Every day, he begs for a few coins at the street corner.",,
33,to [get] rid of {sb/sth},/…°…õt …Ļňą…™d  Ćv ňĆ…õsbňąiňź slňą√¶ É ňĆ…õstňĆiňźňąe…™t É/,Getting rid of noise enhances the quality of your audio and makes it sound more pleasing to the ears.,,
34,objection,/…ôbňąd í…õk É…ôn/,He raised an objection during the meeting when he disagreed with the proposed budget cuts.,,
