ÔĽŅorder,word,phonetic,example,note,definition_en
1,adventurous,"/√¶dňąv…õnt É…Ě…ôs/, /…ôdňąv…õnt É…Ě…ôs/","She's an adventurous traveler, always seeking out new destinations and immersive cultural experiences.",,
2,to alarm,/…ôňą…ę…Ď…Ļm/,The unfamiliar sound in the house alarmed her at night.,,
3,alarmed,/…ôňą…ę…Ď…Ļmd/,She felt alarmed when she heard the sound of glass breaking downstairs.,,
4,daring,/ňąd…õ…Ļ…™Ňč/,She climbed the steep mountain cliff with daring determination.,,
5,at-risk,/√¶t…Ļňą…™sk/,The organization provides support services for at-risk youth to prevent homelessness.,,
6,risk,/r…™sk/,Investing in stocks carries a higher risk of financial loss compared to placing money in a savings account.,,
7,critical,/ňąk…Ļ…™t…™k…ô…ę/,"The patient's condition was critical, and doctors worked quickly to stabilize him.",,
8,deadly,/ňąd…õd…ęi/,The explosion had deadly consequences.,,
9,desperate,"/ňąd…õsp…Ě…™t/, /ňąd…õsp…Ļ…™t/",The police issued a warning about a desperate fugitive who was considered armed and dangerous.,,
10,offensive,/…ôňąf…õns…™v/,His offensive jokes made many people uncomfortable at the party.,,
11,harmless,/ňąh…Ď…Ļm…ę…ôs/,The puppy's playful behavior was harmless and endearing.,,
12,high-risk,/hňąa…™…Ļňą…™sk/,"Investing in high-risk stocks can yield high returns, but it also comes with the potential for significant losses.",,
13,low-risk,/lňąo ä…Ļňą…™sk/,Investing in government bonds is considered low-risk compared to investing in stocks.,,
14,secure,/s…™ňąkj är/,"The bank vault is highly secure, with multiple layers of security measures in place.",,
15,harmful,/ňąh…Ď…Ļmf…ô…ę/,Smoking is harmful to your health.,,
16,insecure,/ňą…™ns…ôkj…Ě/,The old house had insecure windows that could be easily opened from outside.,,
17,sound,/sa änd/,"Despite economic downturns, their investments remained sound and continued to grow steadily.",,
18,nasty,/ňąn√¶sti/,The hiker encountered a nasty storm while trekking in the mountains.,,
19,risky,/ňą…Ļ…™ski/,Investing in cryptocurrency is considered risky due to its volatility.,,
20,to encounter,"/…™nňąka än…Ě/, /…™nňąka änt…Ě/",The team encountered unexpected challenges while implementing the new software.,,
21,to endanger,/…õnňąde…™nd í…Ě/,Ignoring safety protocols can endanger workers on a construction site.,,
22,to harm,/ňąh…Ď…Ļm/,The malicious rumors were intended to harm the reputation of the individual.,,
23,to pose,/ňąpo äz/,The sudden economic downturn posed a significant threat to the stability of many businesses.,,
24,to threaten,/ňąőł…Ļ…õt…ôn/,The robber threatened the store clerk with a knife if they didn't hand over the money.,,
25,happening,"/ňąh√¶p…ôn…™Ňč/, /ňąh√¶pn…™Ňč/",The art gallery's grand opening was the happening of the week in the local community.,,
26,to rescue,/ňą…Ļ…õskju/,Firefighters rushed to rescue the trapped individuals from the burning building.,,
27,rescuer,/ňą…Ļ…õsňĆkju…Ě/,The rescuer pulled the injured hiker from the mountain.,,
28,threat,/ňąőł…Ļ…õt/,Pollution is a major threat to marine life.,,
29,out of harm's way,/ňĆa ä…ĺ…ôv hňą…Ďňź…Ļmz wňąe…™/,"After the wildfire broke out, the residents were evacuated to a shelter to keep them out of harm's way.",,
30,to disturb,/d…™ňąst…Ěb/,The unsettling images in the movie disturbed him for days afterward.,,
31,to offend,/…ôňąf…õnd/,His dismissive remarks about her achievements offended her and sparked resentment.,,
32,off the hook,/ňą…Ēf √į…ô hňą äk/,"Thanks to the extension granted by the teacher, I'm off the hook for submitting the assignment today.",,
33,to scream,/ňąsk…Ļim/,The unexpected appearance of the ghost in the movie caused the audience to scream in terror.,,
34,neutral,/ňąnut…Ļ…ô…ę/,It‚Äôs important to keep a neutral tone when discussing sensitive topics.,,
35,to alert,/…ôňąl…Ět/,The security system alerted the homeowners to a possible break-in with a loud alarm.,,
36,disrespectful,/ňĆd…™s…Ļ…™ňąsp…õktf…ô…ę/,His disrespectful behavior towards his parents embarrassed his family.,,
37,on a razor's edge,/ňĆ…Ďňźn …ź …Ļňąe…™z…öz ňą…õd í/,"The company's financial stability is on a razor's edge, with mounting debts and declining profits.",,
38,fearsome,/ňąf…™…Ļs…ôm/,The fearsome roar of the lion sent shivers down their spines.,,
