ÔĽŅorder,word,phonetic,example,note,definition_en
1,aside,/…ôňąsa…™d/,He gently pushed the chair aside to make space for the guests.,,
2,apparently,/…ôňąp…õ…Ļ…ônt…ęi/,He apparently left the office early today; his desk is empty.,,
3,approximately,/…ôňąp…Ļ…Ďks…ôm…ôt…ęi/,"The journey will take approximately two hours, depending on traffic.",,
4,basically,/ňąbe…™s…™k…ęi/,"She explained the complex scientific concept in a way that anyone could understand, breaking it down to basically illustrate its core principles.",,
5,consistently,/k…ônňąs…™st…ônt…ęi/,He consistently delivers high-quality work on every project.,,
6,constantly,/ňąk…Ďnst…ônt…ęi/,She was constantly checking her phone for messages.,,
7,critically,"/ňąk…Ļ…™t…™k…ô…ęi/, /ňąk…Ļ…™t…™k…ęi/",She spoke critically about the new government policy during the meeting.,,
8,daringly,/dňą…õ…Ļ…Ļ…™Ňčli/,"She climbed the mountain daringly, seeking excitement.",,
9,deeply,/ňądip…ęi/,She was deeply moved by the kindness of strangers.,,
10,deliberately,"/d…™ňą…ę…™b…Ě…ôt…ęi/, /d…™ňą…ę…™b…Ļ…ôt…ęi/",He deliberately ignored the warning signs.,,
11,disappointingly,"/d…™s…ôňąp…Ē…™n…™Ňč…ęi/, /d…™s…ôňąp…Ē…™nt…™Ňč…ęi/",The highly anticipated sequel performed disappointingly at the box office.,,
12,elsewhere,/ňą…õ…ęňĆsw…õ…Ļ/,"The store was out of stock, so I had to look elsewhere for the product.",,
13,entirely,/…™nňąta…™…Ě…ęi/,The puzzle was entirely solved by the dedicated team.,,
14,gradually,"/ňą…°…Ļ√¶d íu…ô…ęi/, /ňą…°…Ļ√¶d íu…ęi/","As the project advanced, the team's understanding of the requirements deepened gradually.",,
15,harmlessly,/ňąh…Ď…Ļm…ę…ôs…ęi/,The small wave crashed harmlessly against the shore.,,
16,hopelessly,/ňąho äp…ę…ôs…ęi/,The map was old and hopelessly out of date.,,
17,initially,/ňĆ…™ňąn…™ É…ô…ęi/,The drug was initially tested on mice before human trials.,,
18,inevitably,/ňĆ…™ňąn…õv…ôt…ôb…ęi/,"With the heavy rain, traffic jams inevitably ensued on the city streets.",,
19,largely,/ňą…ę…Ď…Ļd í…ęi/,The success of the campaign was largely due to social media engagement.,,
20,literally,"/ňą…ę…™t…Ě…ô…ęi/, /ňą…ę…™t…Ļ…ô…ęi/",Her excitement was so intense that she literally jumped up and down when she received the award.,,
21,nevertheless,/ňĆn…õv…Ě√į…ôňą…ę…õs/,The plan was risky; they proceeded nevertheless.,,
22,occasionally,"/…ôňąke…™ í…ôn…ô…ęi/, /…ôňąke…™ í…ôn…ęi/, /…ôňąke…™ ín…ô…ęi/",She visits her grandparents occasionally.,,
23,otherwise,/ňą…ô√į…ĚňĆwa…™z/,"You should pack your umbrella, otherwise you might get wet in the rain.",,
24,overall,/ňąo äv…ĚňĆ…Ē…ę/,"He felt overall satisfied with his performance in the exam, despite a few mistakes.",,
25,partly,/ňąp…Ď…Ļt…ęi/,The project was successful partly due to her leadership.,,
26,precisely,"/p…Ļiňąsa…™s…ęi/, /p…Ļ…™ňąsa…™s…ęi/",The coordinates were entered precisely to ensure accurate navigation.,,
27,relatively,/ňą…Ļ…õ…ę…ôt…™v…ęi/,The test was relatively easy compared to the last one.,,
28,strictly,/ňąst…Ļ…™kt…ęi/,Employees are strictly prohibited from using personal devices during work hours.,,
29,somewhat,"/ňąs…ômňąw…ôt/, /ňąs…ômhňąw…ôt/",I was somewhat surprised by his reaction.,,
30,subsequently,/ňąs…ôbs…ôkw…ônt…ęi/,She moved to France and subsequently began studying art.,,
31,truly,/ňąt…Ļu…ęi/,I am truly grateful for your help.,,
32,ultimately,/ňą…ô…ęt…ôm…ôt…ęi/,"After considering various options, they ultimately chose the most cost-effective solution for the project.",,
33,unsuccessfully,/ňĆ…ôns…ôkňąs…õsf…ô…ęi/,"Despite multiple attempts, he unsuccessfully tried to repair the broken machinery.",,
34,way,/we…™/,He runs way faster than anyone else on the team.,,
35,a tad,/…ź tňą√¶d/,He's a tad taller than his older brother.,,
36,widely,/ňąwa…™d…ęi/,Standards vary widely in different regions.,,
37,gently,/ňąd í…õnt…ęi/,He gently reminded her not to overwork herself.,,
38,alongside,/…ôňą…ę…ĒŇčňąsa…™d/,She stood alongside her best friend during the graduation ceremony.,,
39,accordingly,/…ôňąk…Ē…Ļd…™Ňč…ęi/,"The weather forecast predicted rain, so she dressed accordingly with a raincoat and boots.",,
40,beyond,"/ňĆbiňą…Ēnd/, /b…™ňą…Ďnd/, /b…™ňą…Ēnd/",We hiked past the cabin and beyond into the forest.,,
