ÔĽŅorder,word,phonetic,example,note,definition_en
1,alarm clock,/…ôňąl…Ďňźrm kl…Ďňźk/,I always set multiple alarms on my alarm clock to ensure I wake up.,,
2,equipment,/…™ňąkw…™pm…ônt/,"She packed her camping equipment, including a tent and a sleeping bag.",,
3,device,/d…™ňąva…™s/,The flashlight is a simple yet helpful device during power outages.,,
4,loudspeaker,/ňąla ädňĆspiňźk…ö/,Please lower the volume on the loudspeaker; it's too loud.,,
5,camera,/ňąk√¶mr…ô/,He borrowed his friend's camera to document the event.,,
6,dishwasher,/ňąd…™ ÉňĆw…Ďňź É…ö/,"He pressed the ""start"" button on the dishwasher and walked away.",,
7,washing machine,/ňąw…Ďňź É…™Ňč m…ôňą Éiňźn/,He forgot to empty the pockets before putting the clothes in the washing machine.,,
8,oven,/ňą Ćv…ôn/,He used the oven's timer to remind him to check on the cookies.,,
9,coffee maker,/ňąk…Ďňźfi ňąme…™k…ö/,She cleaned the coffee maker's filter to remove any coffee residue.,,
10,toaster oven,/ňąto äst…ö ňą Ćv…ôn/,She uses a toaster oven to quickly toast her bread in the morning.,,
11,air conditioner,/ňą…õr k…ônňĆd…™ É…™n…ö/,He called a technician to repair the air conditioner when it stopped working.,,
12,heater,/ňąhiňźt…ö/,She turned on the heater to warm up the room.,,
13,radio,/ňąre…™diňĆo ä/,The radio program has interesting interviews.,,
14,telephone,/ňąt…õl…ôňĆfo än/,He needs to recharge his telephone battery.,,
15,line,/la…™n/,"He dialed the number, and a voice answered on the other end of the line.",,
16,hair dryer,/ňąh…õr ňĆdra…™…ö/,I bought a travel-sized hair dryer for my vacations.,,
17,fan,/f√¶n/,"During the summer, the electric fan is our best friend.",,
18,vacuum cleaner,/ňąv√¶kjuňĆm ňąkliňźn…ö/,"Before using the vacuum cleaner, make sure to remove any large objects from the floor.",,
19,iron,/ňąa…™…ön/,My sister taught me a handy trick to iron collars and cuffs.,,
20,remote control,/r…™ňąmo ät k…ônňątro äl/,He pressed the button on the remote control to pause the movie.,,
21,smoke detector,/ňąsmo äk ňąd…™ňĆt…õkt…ö/,"I forgot to replace the battery in the smoke detector, so it wasn't working properly.",,
22,to turn on,/t…Ěňźn …Ďňźn/,"Before using the printer, make sure to turn it on and check for paper.",,
23,to turn off,/t…Ěňźn …íf/,Don't forget to turn off the TV when you're finished watching it.,,
24,to work,/w…Ěňźk/,"The elevator is not working, we have to take the stairs.",,
25,broken,/ňąbro äk…ôn/,The broken printer refused to print the documents.,,
26,to use,"/jus/ , /juz/",He is using his phone to take a picture.,,
27,system,/ňąs…™st…ôm/,Our school uses an online learning system for assignments and grades.,,
28,to repair,/r…™ňąp…õr/,Can you help me repair this torn book page with tape?,,
29,flashlight,/ňąfl√¶ ÉňĆla…™t/,"During the blackout, everyone relied on their flashlights.",,
30,carpet,/ňąk…Ďňźrp…™t/,I laid the baby down on the soft carpet for a nap.,,
31,furniture,/ňąf…Ěňźn…™t É…ö/,My father cleaned and polished the wooden furniture to keep it looking nice.,,
