ÔĽŅorder,word,phonetic,example,note,definition_en
1,communication,/k…ôňĆmjuňźn…™ňąke…™ É…ôn/,Good communication is key to a successful relationship.,,
2,conversation,/ňĆk…Ďňźnv…öňąse…™ É…ôn/,"During our conversation, I learned he had lived in Italy for five years.",,
3,opinion,/…ôňąp…™nj…ôn/,"Despite popular opinion, I really enjoyed the movie.",,
4,talk,/t…Ďňźk/,"After a long talk, they finally resolved their differences.",,
5,call,/k…Ēňźl/,"During the call, he shared the good news.",,
6,cell phone,/ňąs…õl ňĆfo än/,Can you please mute your cell phone during the movie?,,
7,argument,/ňą…Ďňźr…°j…ôm…ônt/,His strong argument convinced the team to change their strategy.,,
8,discussion,/d…™ňąsk Ć É…ôn/,The book club meeting ended with a lively discussion about the novel.,,
9,fight,/fa…™t/,"After the fight about the broken vase, they didn't talk for a week.",,
10,letter,/ňąl…õt…ö/,I received a thank-you letter from the charity I donated to.,,
11,mail,/me…™l/,My sister works for the local mail service.,,
12,envelope,"/ňą…õnv…ôňĆlo äp/ , /ňą…Ďňźnv…ôňĆlo äp/",He wrote the address on the envelope.,,
13,to say,/se…™/,He was saying that he wanted to quit his job and travel the world.,,
14,to tell,/t…õl/,Did he tell you about the new project?,,
15,to discuss,/d…™ňąsk Ćs/,He wanted to discuss his concerns with the manager before making a formal complaint.,,
16,to visit,/ňąv…™z…™t/,I love to visit my uncle because he tells great stories.,,
17,to reply,/r…™ňąpla…™/,I need to reply to the email from my boss.,,
18,to argue,/ňą…Ďňźr…°juňź/,He argues with everyone at work; it's so annoying!,,
19,to mail,/me…™l/,He mailed his application to the university yesterday.,,
20,together,/t…ôňą…°…õ√į…ö/,We walked together through the quiet streets.,,
21,calmly,/ňąk…Ďňźmli/,She calmly explained her point despite the heated debate.,,
22,alone,/…ôňąlo än/,He likes to eat lunch alone and enjoy some quiet time.,,
23,social,/ňąso ä É…ôl/,He's not very social and prefers to stay at home.,,
24,to send,/s…õnd/,I need to send this important document to the head office by express mail.,,
25,to receive,/r…™ňąsiňźv/,"Every morning, he receives a newspaper at his doorstep.",,
26,to understand,/ňĆ Ćnd…öňąst√¶nd/,Can you help me understand this equation?,,
27,to misunderstand,/ňĆm…™s Ćnd…öňąst√¶nd/,He misunderstood the meeting time and arrived an hour early.,,
28,to agree,/…ôňą…°riňź/,She agreed with the teacher's comment about her essay.,,
29,to disagree,/ňĆd…™s…ôňą…°riňź/,He disagreed with the critic's review of the play.,,
30,to accept,/√¶kňąs…õpt/,He accepted the responsibility of caring for the dog.,,
31,to reject,/r…™ňąd í…õkt/,"He rejected the first draft of the report, asking for major revisions.",,
32,all right,/ňĆ…Ēňźl ňąra…™t/,"All right, I will help you with your homework.",,
33,statement,/ňąste…™tm…ônt/,His statement about the event was very detailed.,,
34,wow,/wa ä/,"I can't believe you finished the race so quickly, wow!",,
35,ah,/…Ďňź/,"Ah, could you please turn down the music?",,
36,oh,/ňąo ä/,"Oh, I didn't know you could play the guitar.",,
37,yeah,/j…õ/,"Yeah, I agree with you on that point.",,
38,hey,/he…™/,"Hey, how's it going?",,
39,note,/no ät/,I received a thank-you note from my colleague for helping with a project.,,
40,invitation,/ňĆ…™nv…™ňąte…™ É…ôn/,She received an invitation to her friend's birthday party next weekend.,,
41,to communicate,/k…ôňąmjuňźn…™ňĆke…™t/,She communicates effectively with her team members.,,
42,to complain,/k…ômňąple…™n/,Emily likes to complain about the long commute to work every morning.,,
43,to invite,/…™nňąva…™t/,She invites friends over for dinner every Friday night.,,
44,to pronounce,/pr…ôňąna äns/,She pronounces each word with clarity during the language class.,,
