ÔĽŅorder,word,phonetic,example,note,definition_en
1,to raise,/re…™z/,Can you raise the lamp so I can see?,,
2,to react,/riňą√¶kt/,"The political leader had to react promptly to the evolving situation, addressing concerns and making policy adjustments.",,
3,to realize,/ňąri…ôňĆla…™z/,He realized his mistake at once after reviewing the report.,,
4,to recognize,/ňąr…õk…ô…°ňĆna…™z/,I immediately recognized her voice on the phone.,,
5,to recommend,/ňĆr…õk…ôňąm…õnd/,She regularly recommends this book to anyone interested in history.,,
6,to record,/r…™ňąk…Ēňźrd/,She records her daily expenses in a spreadsheet.,,
7,to refer,/r…ôňąf…úr/,The clinic doctor referred the patient to an oncologist for further tests and potential tumor management.,,
8,to remove,/r…™ňąmuv/,The surgeon will carefully remove the tumor during the operation.,,
9,to replace,/r…™ňąple…™s/,"The company decided to replace the outdated equipment with newer, more efficient models.",,
10,to report,/r…™ňąp…Ērt/,"Scientists will report their findings during the conference, sharing their research with the academic community.",,
11,to respond,/r…™ňąsp…Ďnd/,She regularly responds promptly to emails from clients.,,
12,to rise,/ra…™z/,The hot air balloon rose gracefully into the sky.,,
13,to sail,/se…™l/,"The sailboat gracefully sailed across the open sea, propelled by the ocean breeze.",,
14,to save,/se…™v/,Lifeguards work tirelessly to save swimmers in distress.,,
15,to seem,/siňźm/,Choose whichever path seems right for you.,,
16,to shake,/ Ée…™k/,She shakes the salad dressing vigorously to emulsify the ingredients.,,
17,to shout,/ Éa ät/,"Frustrated with the distant conversation, she had to shout to make herself heard across the crowded room.",,
18,to sign,/sa…™n/,The author regularly signs copies of her books at book signings.,,
19,to ski,/skiňź/,Winter enthusiasts often ski down slopes to enjoy the snowy landscapes.,,
20,to star,/st…Ďr/,He starred in a critically acclaimed play at the local theater.,,
21,to steal,/stiňźl/,She steals cookies from the jar when no one is looking.,,
22,to suppose,/s…ôňąpo äz/,I suppose she‚Äôll be at the meeting since she confirmed her attendance earlier.,,
23,to text,/t…õkst/,You can text your friend to ask for advice.,,
24,to tie,/ta…™/,The construction workers are tying reinforcing steel bars together for the foundation.,,
25,to notice,/ňąno ät…™s/,I couldn't help but notice the beautiful sunset as I walked along the beach.,,
26,to attend,/…ôňąt…õnd/,Employees must attend the mandatory training session next week.,,
27,to attack,/…ôňąt√¶k/,The predators in the wild often attack weaker members of the herd.,,
28,to provide,/pr…ôňąva…™d/,The company will provide training for all new employees.,,
29,to search,/s…Ě ß/,"The detectives searched the area for evidence, meticulously examining every detail for clues.",,
30,to keep,/kiňźp/,She keeps her room tidy.,,
31,to pull,/p äl/,She pulled her suitcase behind her as she walked through the airport.,,
32,to push,/p ä É/,She pushed the cart down the aisle at the grocery store.,,
